,title,average_rating,director,writer,metascore,cast,country_of_origin,languages,runtime,genre,budget,worldwide_gross,release_year,profit_or_loss,p&l_rate
1772,Total Recall,7.5,Paul Verhoeven,"Philip K. Dick, Ronald Shusett, Dan O'Bannon",60,"Arnold Schwarzenegger, Sharon Stone, Michael Ironside, Rachel Ticotin, Ronny Cox, Marshall Bell, Mel Johnson Jr., Michael Champion, Roy Brocksmith, Ray Baker, Rosemary Dunsmore, David Knell, Alexia Robinson, Dean Norris, Mark Carlton, Debbie Lee Carrington, Lycia Naff, Robert Costanzo","United States, Mexico",English,113,"Action, Adventure, Sci-Fi            ",65000000,261317921,1990,196317921,302.03
1773,The Abyss,7.5,James Cameron,James Cameron,62,"Ed Harris, Mary Elizabeth Mastrantonio, Michael Biehn, Leo Burmester, Todd Graff, John Bedford Lloyd, J.C. Quinn, Kimberly Scott, Captain Kidd Brewer Jr., George Robert Klek, Christopher Murphy, Adam Nelson, Dick Warlock, Jimmie Ray Weeks, J. Kenneth Campbell, Ken Jenkins, Chris Elliott, Peter Ratray",United States,English,140,"Adventure, Drama, Mystery            ",70000000,90520202,1989,20520202,29.31
1774,The Fabelmans,7.5,Steven Spielberg,"Steven Spielberg, Tony Kushner",85,"Michelle Williams, Gabriel LaBelle, Paul Dano, Judd Hirsch, Seth Rogen, Mateo Zoryan, Keeley Karsten, Alina Brace, Julia Butters, Birdie Borria, Sophia Kopera, Jeannie Berlin, Robin Bartlett, Sam Rechner, Oakes Fegley, Chloe East, Isabelle Kusman, Chandler Lovelle","United States, India",English,151,Drama            ,40000000,45620703,2023,5620703,14.05
1775,Jackie Brown,7.5,Quentin Tarantino,"Quentin Tarantino, Elmore Leonard",62,"Pam Grier, Samuel L. Jackson, Robert Forster, Bridget Fonda, Michael Keaton, Robert De Niro, Michael Bowen, Chris Tucker, LisaGay Hamilton, Tom Lister Jr., Hattie Winston, Sid Haig, Aimee Graham, Ellis Williams, Tangie Ambrose, T'Keyah Crystal Keymáh, Venessia Valentino, Diana Uribe",United States,English,154,"Crime, Drama, Thriller            ",12000000,39693845,1998,27693845,230.78
1776,An American Werewolf in London,7.5,John Landis,John Landis,55,"David Naughton, Jenny Agutter, Joe Belcher, Griffin Dunne, David Schofield, Brian Glover, Lila Kaye, Rik Mayall, Sean Baker, Paddy Ryan, Anne-Marie Davies, John Woodvine, Frank Oz, Don McKillop, Paul Kember, Colin Fernandes, Albert Moses, Jim Henson","United Kingdom, United States",English,97,"Comedy, Horror            ",10000000,30819283,1981,20819283,208.19
1777,The Warriors,7.5,Walter Hill,"Sol Yurick, David Shaber, Walter Hill",65,"Michael Beck, James Remar, Dorsey Wright, Brian Tyler, David Harris, Tom McKitterick, Marcelino Sánchez, Terry Michos, Deborah Van Valkenburgh, Roger Hill, David Patrick Kelly, Lynne Thigpen, Ginny Ortiz, Mercedes Ruehl, John Snyder, Dennis Gregory, Gwynn Press, Jodi Price",United States,English,93,"Action, Crime, Thriller            ",4000000,22495288,1979,18495288,462.38
1778,Indiana Jones and the Temple of Doom,7.5,Steven Spielberg,"Willard Huyck, Gloria Katz, George Lucas",57,"Harrison Ford, Kate Capshaw, Ke Huy Quan, Amrish Puri, Roshan Seth, Philip Stone, Roy Chiao, David Yip, Ric Young, Chua Kah Joo, Rex Ngui, Philip Tan, Dan Aykroyd, Akio Mitamura, Michael Yama, D.R. Nanayakkara, Dharmadasa Kuruppu, Stany De Silva",United States,"English, Sinhala, Hindi",118,"Action, Adventure            ",28000000,333107271,2020,305107271,1089.67
1779,Contact,7.5,Robert Zemeckis,"James V. Hart, Michael Goldenberg, Carl Sagan",62,"Jodie Foster, Matthew McConaughey, Tom Skerritt, John Hurt, Jena Malone, David Morse, Geoffrey Blake, William Fichtner, Sami Chester, Timothy McNeil, Laura Elena Surillo, Henry Strozier, Max Martini, Larry King, Thomas Garner, Conroy Chino, Dan Gifford, James Woods",United States,"English, Spanish, German, Russian",150,"Drama, Mystery, Sci-Fi            ",90000000,171120329,2013,81120329,90.13
1780,Doctor Strange,7.5,Scott Derrickson,"Jon Spaihts, Scott Derrickson, C. Robert Cargill",72,"Benedict Cumberbatch, Chiwetel Ejiofor, Rachel McAdams, Benedict Wong, Mads Mikkelsen, Tilda Swinton, Michael Stuhlbarg, Benjamin Bratt, Scott Adkins, Zara Phythian, Alaa Safi, Katrina Durden, Topo Wresniwiro, Umit Ulgen, Linda Louise Duan, Mark Anthony Brighton, Meera Syal, Amy Landecker",United States,English,115,"Action, Adventure, Fantasy            ",165000000,677796833,2016,512796833,310.79
1781,We Need to Talk About Kevin,7.5,Lynne Ramsay,"Lynne Ramsay, Rory Stewart Kinnear, Lionel Shriver",68,"Tilda Swinton, John C. Reilly, Ezra Miller, Jasper Newell, Rocky Duer, Ashley Gerasimovich, Siobhan Fallon Hogan, Alex Manette, Kenneth Franklin, Leslie Lyles, Paul Diomede, Michael Campbell, J. Mallory McCree, Mark Elliot Wilson, James Chen, Lauren Fox, Blake DeLong, Andy Gershenzon","United Kingdom, United States",English,112,"Drama, Mystery, Thriller            ",7000000,9212174,2011,2212174,31.6
1782,Legends of the Fall,7.5,Edward Zwick,"Susan Shilliday, William D. Wittliff, Jim Harrison",45,"Brad Pitt, Anthony Hopkins, Aidan Quinn, Julia Ormond, Henry Thomas, Karina Lombard, Tantoo Cardinal, Gordon Tootoosis, Paul Desmond, Christina Pickles, Robert Wisden, John Novak, Kenneth Welsh, Bill Dow, Sam Sarkar, Nigel Bennett, Keegan MacIntosh, Eric Johnson",United States,"English, Cornish",133,"Drama, Romance, War            ",30000000,160638883,1995,130638883,435.46
1783,Sideways,7.5,Alexander Payne,"Rex Pickett, Alexander Payne, Jim Taylor",94,"Paul Giamatti, Thomas Haden Church, Virginia Madsen, Sandra Oh, Marylouise Burke, Jessica Hecht, Missy Doty, M.C. Gainey, Alysia Reiner, Shake Tukhmanyan, Shaun Duke, Robert Covarrubias, Patrick Gallagher, Stephanie Faracy, Joe Marinelli, Chris Burroughs, Toni Howard, Khoren Babouchian",United States,"English, Armenian, French",127,"Comedy, Drama, Romance            ",16000000,109706931,2004,93706931,585.67
1784,Richard Jewell,7.5,Clint Eastwood,"Billy Ray, Marie Brenner, Kent Alexander",68,"Paul Walter Hauser, Sam Rockwell, Brandon Stanley, Ryan Boz, Charles Green, Olivia Wilde, Mike Pniewski, Jon Hamm, Ian Gomez, Nina Arianda, Kathy Bates, Ronnie Allen, David Lengel, Beth Keener, Grant Roberts, Alan Heckner, Desmond Phillips, Alex Collins",United States,English,131,"Biography, Crime, Drama            ",45000000,44645542,2019,-354458,-0.79
1785,Upgrade,7.5,Leigh Whannell,Leigh Whannell,67,"Logan Marshall-Green, Melanie Vallejo, Steve Danielsen, Abby Craden, Harrison Sloan Gilbertson, Benedict Hardie, Richard Cawthorne, Christopher Kirby, Richard Anastasios, Kenny Low, Linda Cropper, Betty Gabriel, Emily Havea, Ming-Zhu Hii, Simon Maiden, Stephanie Demkiw, Manjot Jassal, Esther Joseph","United States, Australia","English, Dutch",100,"Action, Sci-Fi, Thriller            ",5000000,16706680,2020,11706680,234.13
1786,Zombieland,7.5,Ruben Fleischer,"Rhett Reese, Paul Wernick",73,"Jesse Eisenberg, Emma Stone, Woody Harrelson, Abigail Breslin, Amber Heard, Bill Murray, Derek Graf, Cesar Aguirre, Jacob G. Akins, Hunter Aldridge, Elle Alexander, Cameron Jacob Alpert, Michael August, Carey Beckerdite, Melanie Booth, Daniel Burnley, Chris Burns, Dalton Cole",United States,"English, Spanish, French",88,"Action, Comedy, Horror            ",23600000,102392080,2010,78792080,333.86
1787,Incredibles 2,7.5,Brad Bird,Brad Bird,80,"Craig T. Nelson, Holly Hunter, Sarah Vowell, Huck Milner, Catherine Keener, Eli Fucile, Bob Odenkirk, Samuel L. Jackson, Michael Bird, Sophia Bush, Brad Bird, Phil LaMarr, Isabella Rossellini, Adam Gates, Jonathan Banks, John Ratzenberger, Bill Wise, Nicholas Bird","United States, Japan",English,118,"Animation, Action, Adventure            ",200000000,1243225667,2018,1043225667,521.61
1788,The Hunt for Red October,7.5,John McTiernan,"Tom Clancy, Larry Ferguson, Donald E. Stewart",58,"Sean Connery, Alec Baldwin, Scott Glenn, Sam Neill, James Earl Jones, Joss Ackland, Richard Jordan, Peter Firth, Tim Curry, Courtney B. Vance, Stellan Skarsgård, Jeffrey Jones, Timothy Carhart, Larry Ferguson, Fred Thompson, Daniel Davis, Ned Vaughn, Anthony Peck",United States,"English, Russian",135,"Action, Adventure, Thriller            ",30000000,200512643,2021,170512643,568.38
1789,A Time to Kill,7.5,Joel Schumacher,"John Grisham, Akiva Goldsman",53,"Matthew McConaughey, Sandra Bullock, Samuel L. Jackson, Kevin Spacey, Oliver Platt, Charles S. Dutton, Brenda Fricker, Donald Sutherland, Kiefer Sutherland, Patrick McGoohan, Ashley Judd, Tonea Stewart, RaéVen Kelly, Darrin Mitchell, LaConte McGrew, Devin Lloyd, John Diehl, Chris Cooper",United States,English,149,"Crime, Drama, Thriller            ",40000000,152266007,1996,112266007,280.67
1790,Munich,7.5,Steven Spielberg,"Tony Kushner, Eric Roth, George Jonas",74,"Eric Bana, Daniel Craig, Marie-Josée Croze, Ciarán Hinds, Mathieu Kassovitz, Hanns Zischler, Ayelet Zurer, Geoffrey Rush, Gila Almagor, Michael Lonsdale, Mathieu Amalric, Moritz Bleibtreu, Valeria Bruni Tedeschi, Meret Becker, Yvan Attal, Ami Weinberg, Lynn Cohen, Amos Lavi","United States, Canada, France","English, German, French, Hebrew, Arabic, Italian, Greek, Russian, Dutch",164,"Action, Drama, History            ",70000000,130982407,2018,60982407,87.12
1791,BlacKkKlansman,7.5,Spike Lee,"Charlie Wachtel, David Rabinowitz, Kevin Willmott",83,"John David Washington, Adam Driver, Laura Harrier, Topher Grace, Alec Baldwin, Isiah Whitlock Jr., Robert John Burke, Brian Tarantina, Arthur J. Nascarella, Ken Garito, Frederick Weller, Michael Buscemi, Damaris Lewis, Ato Blankson-Wood, Corey Hawkins, Dared Wright, Faron Salisbury, Ryan Eggold","United States, China",English,135,"Biography, Comedy, Crime            ",15000000,93413709,2020,78413709,522.76
1792,Leaving Las Vegas,7.5,Mike Figgis,"John O'Brien, Mike Figgis",82,"Nicolas Cage, Elisabeth Shue, Julian Sands, Richard Lewis, Steven Weber, Kim Adams, Emily Procter, Stuart Regen, Valeria Golino, Graham Beckel, Albert Henderson, Shashi Bhatia, Carey Lowell, Anne Lange, Thomas Kopache, Vincent Ward, Lucinda Jenney, French Stewart",United States,"English, Russian",111,"Drama, Romance            ",3600000,32029928,1996,28429928,789.72
1793,The Wicker Man,7.5,Robin Hardy,"Anthony Shaffer, David Pinner",87,"Edward Woodward, Christopher Lee, Diane Cilento, Britt Ekland, Ingrid Pitt, Lindsay Kemp, Russell Waters, Aubrey Morris, Irene Sunters, Walter Carr, Ian Campbell, Leslie Blackater, Roy Boyd, Peter Brewis, Barbara Rafferty, Juliet Cadzow, Ross Campbell, Penny Cluer",United Kingdom,English,88,"Horror, Mystery, Thriller            ",810000,528514,1973,-281486,-34.75
1794,Fear and Loathing in Las Vegas,7.5,Terry Gilliam,"Hunter S. Thompson, Terry Gilliam, Tony Grisoni",41,"Johnny Depp, Benicio Del Toro, Tobey Maguire, Michael Lee Gogin, Larry Cedar, Brian Le Baron, Katherine Helmond, Michael Warwick, Craig Bierko, Tyde Kierney, Mark Harmon, Tim Thomerson, Richard Riehle, Ransom Gates, Laraine Newman, Frank Romano, Gil Boccaccio, Gary Bruno",United States,English,118,"Adventure, Comedy, Drama            ",18500000,10680275,1998,-7819725,-42.27
1795,The Favourite,7.5,Yorgos Lanthimos,"Deborah Davis, Tony McNamara",91,"Olivia Colman, Emma Stone, Rachel Weisz, Nicholas Hoult, Emma Delves, Faye Daveney, Paul Swaine, Jennifer White, Lilly-Rose Stevens, Denise Mack, James Smith, Mark Gatiss, Horatio, Willem Dalby, Edward Aczel, Carolyn Saint-Pé, John Locke, Everal A Walsh","Ireland, United Kingdom, United States",English,119,"Biography, Comedy, Drama            ",15000000,95918706,2019,80918706,539.46
1796,Brooklyn,7.5,John Crowley,"Nick Hornby, Colm Tóibín",88,"Saoirse Ronan, Emory Cohen, Domhnall Gleeson, Jim Broadbent, Hugh Gormley, Brid Brennan, Maeve McGrath, Emma Lowe, Barbara Drennan, Gillian McCarthy, Fiona Glascott, Jane Brennan, Eileen O'Higgins, Art Campion, Eva Birthistle, James Corscadden, Julie Walters, Emily Bett Rickards","Ireland, United Kingdom, Canada, United States","English, Latin, Irish Gaelic",117,"Drama, Romance            ",11000000,62402155,2016,51402155,467.29
1797,The Hurt Locker,7.5,Kathryn Bigelow,Mark Boal,95,"Jeremy Renner, Anthony Mackie, Brian Geraghty, Guy Pearce, Ralph Fiennes, David Morse, Evangeline Lilly, Christian Camargo, Suhail Dabbach, Christopher Sayegh, Nabil Koni, Sam Spruell, Sam Redford, Feisal Sadoun, Barrie Rice, Imad Dadudi, Erin Gann, Justin Campbell","United States, Luxembourg","English, Arabic",131,"Drama, Thriller, War            ",15000000,49259766,2010,34259766,228.4
1798,Lone Survivor,7.5,Peter Berg,"Peter Berg, Marcus Luttrell, Patrick Robinson",60,"Mark Wahlberg, Taylor Kitsch, Emile Hirsch, Ben Foster, Yousuf Azami, Ali Suliman, Eric Bana, Alexander Ludwig, Rich Ting, Dan Bilzerian, Jerry Ferrara, Rick Vargas, Scott Elrod, Gregory Rockwood, Ryan Kay, Patrick Griffin, Josh Berry, Eric Steinig","United States, United Kingdom","English, Pashtu, Arabic",121,"Action, Biography, Drama            ",40000000,154802912,2014,114802912,287.01
1799,The Aviator,7.5,Martin Scorsese,John Logan,77,"Leonardo DiCaprio, Cate Blanchett, Kate Beckinsale, John C. Reilly, Alec Baldwin, Alan Alda, Ian Holm, Danny Huston, Gwen Stefani, Jude Law, Adam Scott, Matt Ross, Kelli Garner, Frances Conroy, Brent Spiner, Stanley DeSantis, Edward Herrmann, Willem Dafoe","United States, Germany","English, Persian",170,"Biography, Drama            ",110000000,213719942,2005,103719942,94.29
1800,Lolita,7.5,Stanley Kubrick,"Vladimir Nabokov, Stanley Kubrick, James B. Harris",79,"James Mason, Shelley Winters, Sue Lyon, Gary Cockrell, Jerry Stovin, Diana Decker, Lois Maxwell, Cec Linder, Bill Greene, Shirley Douglas, Marianne Stone, Marion Mathie, James Dyrenforth, Maxine Holden, John Harrison, Colin Maitland, Terry Kilburn, C. Denier Warren","United Kingdom, United States","English, French, Spanish, German",153,"Crime, Drama, Romance            ",2000000,7411,1962,-1992589,-99.63
1801,Blow,7.5,Ted Demme,"Bruce Porter, David McKenna, Nick Cassavetes",52,"Johnny Depp, Penélope Cruz, Franka Potente, Rachel Griffiths, Paul Reubens, Jordi Mollà, Cliff Curtis, Miguel Sandoval, Ethan Suplee, Ray Liotta, Kevin Gage, Max Perlich, Jesse James, Miguel Pérez, Dan Ferro, Tony Amendola, Bobcat Goldthwait, Michael Tucci",United States,English,124,"Biography, Crime, Drama            ",53000000,83282296,2020,30282296,57.14
1802,Perfume: The Story of a Murderer,7.5,Tom Tykwer,"Andrew Birkin, Bernd Eichinger, Tom Tykwer",56,"Ben Whishaw, Dustin Hoffman, Alan Rickman, Francesc Albiol, Gonzalo Cunill, Rachel Hurd-Wood, Andrés Herrera, Simon Chandler, David Calder, Richard Felix, Birgit Minichmayr, Reg Wilson, Catherine Boisgontier, Núria Casas, Carlos Gramaje, Sian Thomas, Michael Smiley, Walter Cots","Germany, France, Spain, United States, Belgium",English,147,"Crime, Drama, Fantasy            ",60000000,135039924,2006,75039924,125.07
1803,A Simple Plan,7.5,Sam Raimi,Scott B. Smith,81,"Bill Paxton, Billy Bob Thornton, Bridget Fonda, Brent Briscoe, Jack Walsh, Chelcie Ross, Becky Ann Baker, Gary Cole, Bob Davis, Peter Syvertsen, Tom Carey, John Paxton, Marie Mathay, Paul Magers, Joan Steffand, Jill Sayre, Wayne A. Evenson, Tim Storms","United Kingdom, France, Germany, Japan, United States",English,121,"Crime, Drama, Thriller            ",30000000,16316273,1999,-13683727,-45.61
1805,Source Code,7.5,Duncan Jones,Ben Ripley,74,"Jake Gyllenhaal, Michelle Monaghan, Vera Farmiga, Jeffrey Wright, Michael Arden, Cas Anvar, Russell Peters, Brent Skagford, Craig Thomas, Gordon Masten, Susan Bain, Paula Jean Hixson, Lincoln Ward, Kyle Gatehouse, Albert Kwan, Anne Day-Jones, Clarice Byrne, James A. Woods","United States, Canada, France, Germany",English,93,"Action, Drama, Mystery            ",32000000,147332697,2011,115332697,360.41
1806,Midnight Run,7.5,Martin Brest,George Gallo,78,"Robert De Niro, Charles Grodin, Yaphet Kotto, John Ashton, Dennis Farina, Joe Pantoliano, Richard Foronjy, Robert Miranda, Jack Kehoe, Wendy Phillips, Danielle DuClos, Philip Baker Hall, Tom McCleister, Mary Gillis, John Toles-Bey, Thomas J. Hageboeck, Stanley White, Scott McAfee",United States,English,126,"Action, Comedy, Crime            ",35000000,81613606,2017,46613606,133.18
1807,Secondhand Lions,7.5,Tim McCanlies,Tim McCanlies,52,"Haley Joel Osment, Michael Caine, Robert Duvall, Kyra Sedgwick, Nicky Katt, Josh Lucas, Michael O'Neill, Deirdre O'Connell, Eric Balfour, Christian Kane, Kevin Haberer, Emmanuelle Vaugier, Adam Ozturk, Jennifer Stone, Mitchel Musso, Marc Musso, Joe Stevens, Charles Sanders","United States, United Kingdom, Slovakia",English,111,"Comedy, Drama, Family            ",30000000,48260279,2003,18260279,60.87
1808,"I, Tonya",7.5,Craig Gillespie,Steven Rogers,77,"Margot Robbie, Sebastian Stan, Allison Janney, Julianne Nicholson, Paul Walter Hauser, Bobby Cannavale, Bojana Novakovic, Caitlin Carver, Maizie Smith, Mckenna Grace, Suehyla El-Attar Young, Jason Davis, Mea Allen, Cory Chapman, Amy Fox, Cara Mantella, Joshua Mikel, Lynne Ashe","United States, United Kingdom, Qatar",English,119,"Biography, Comedy, Drama            ",11000000,53939297,2018,42939297,390.36
1811,Enemy at the Gates,7.5,Jean-Jacques Annaud,"Jean-Jacques Annaud, Alain Godard",53,"Jude Law, Ed Harris, Joseph Fiennes, Rachel Weisz, Bob Hoskins, Ron Perlman, Eva Mattes, Gabriel Thomson, Matthias Habich, Sophie Rois, Ivan Shvedoff, Mario Bandi, Hans-Martin Stier, Clemens Schick, Mikhail Matveev, Alexander Schwan, Lenn Kudrjawizki, Hendrik Arnst","Ireland, United Kingdom, France, Germany, United States","English, German, Russian",131,"Action, Drama, War            ",68000000,96976270,2019,28976270,42.61
1812,The Piano,7.5,Jane Campion,Jane Campion,89,"Holly Hunter, Harvey Keitel, Sam Neill, Anna Paquin, Kerry Walker, Geneviève Lemon, Tungia Baker, Ian Mune, Peter Dennett, Te Whatanui Skipwith, Pete Smith, Bruce Allpress, Cliff Curtis, Carla Rupuha, Mahina Tunui, Hori Ahipene, Gordon Hatfield, Mere Boynton","New Zealand, Australia, France","English, British Sign Language, Maori",121,"Drama, Music, Romance            ",7000000,40185556,1993,33185556,474.08
1813,Waves,7.5,Trey Edward Shults,Trey Edward Shults,80,"Taylor Russell, Kelvin Harrison Jr., Alexa Demie, Bill Wise, David Garelik, Justin R. Chan, Joshua Brockington, Krisha Fairchild, Renée Elise Goldsberry, Sterling K. Brown, Albert Link, Clifton Collins Jr., Vivi Pineda, Holland Hayes, Ruben E. A. Brown, Lucas Hedges, David A Payton, Lulu Braha","United States, Canada",English,135,"Drama, Romance, Sport            ",6000000,2576990,2019,-3423010,-57.05
1814,Babel,7.5,Alejandro G. Iñárritu,"Guillermo Arriaga, Alejandro G. Iñárritu",69,"Brad Pitt, Cate Blanchett, Gael García Bernal, Mohamed Akhzam, Peter Wight, Harriet Walter, Trevor Martin, Matyelok Gibbs, Georges Bousquet, Claudine Acs, André Oumansky, Michael Maloney, Dermot Crowley, Wendy Nottingham, Henry Maratray, Linda Broughton, Jean Marc Hulot, Aline Mowat","United States, Mexico, France, Japan","English, Arabic, Spanish, Japanese, Berber languages, French, Russian, Japanese Sign Language",143,Drama            ,25000000,135330835,2006,110330835,441.32
1815,Hugo,7.5,Martin Scorsese,"John Logan, Brian Selznick",83,"Asa Butterfield, Chloë Grace Moretz, Christopher Lee, Ben Kingsley, Sacha Baron Cohen, Ray Winstone, Emily Mortimer, Helen McCrory, Michael Stuhlbarg, Frances de la Tour, Richard Griffiths, Jude Law, Kevin Eldon, Gulliver McGrath, Shaun Aylward, Emil Lager, Angus Barnett, Edmund Kingsley","United States, United Kingdom",English,126,"Adventure, Drama, Family            ",150000000,185770310,2012,35770310,23.85
1816,127 Hours,7.5,Danny Boyle,"Danny Boyle, Simon Beaufoy, Aron Ralston",82,"James Franco, Amber Tamblyn, Kate Mara, Sean Bott, Koleman Stinger, Treat Williams, John Lawrence, Kate Burton, Bailee Michelle Johnson, Parker Hadley, Clémence Poésy, Fenton Quinn, Lizzy Caplan, Peter Joshua Hull, Pieter Jan Brugge, Rebecca C. Olson, Jeffrey Wood, Norman Lehnert","United Kingdom, United States, France","English, Italian",94,"Biography, Drama            ",18000000,60738797,2011,42738797,237.44
1817,"Love, Simon",7.5,Greg Berlanti,"Becky Albertalli, Elizabeth Berger, Isaac Aptaker",72,"Nick Robinson, Jennifer Garner, Josh Duhamel, Katherine Langford, Alexandra Shipp, Logan Miller, Keiynan Lonsdale, Jorge Lendeborg Jr., Talitha Eliana Bateman, Tony Hale, Natasha Rothwell, Miles Heizer, Joey Pollari, Clark Moore, Drew Starkey, Mackenzie Lintz, Cassady McClincy Zhang, Alex Sgambati",United States,"English, German, French",110,"Comedy, Drama            ",17000000,66719009,2018,49719009,292.46
1819,Kiss Kiss Bang Bang,7.5,Shane Black,"Brett Halliday, Shane Black",73,"Robert Downey Jr., Val Kilmer, Michelle Monaghan, Corbin Bernsen, Dash Mihok, Larry Miller, Rockmond Dunbar, Shannyn Sossamon, Angela Lindvall, Indio Falconer Downey, Ariel Winter, Duane Carnahan, Josh Richman, Martha Hackett, Nancy Fish, Bill McAdams Jr., Tanja Reichert, Jake McKinnon",United States,English,103,"Comedy, Crime, Mystery            ",15000000,15785148,2005,785148,5.23
1821,The Assassination of Jesse James by the Coward Robert Ford,7.5,Andrew Dominik,"Andrew Dominik, Ron Hansen",68,"Brad Pitt, Casey Affleck, Sam Shepard, Mary-Louise Parker, Brooklynn Proulx, Dustin Bollinger, Sam Rockwell, Jeremy Renner, Garret Dillahunt, Paul Schneider, Joel McNichol, James Defelice, J.C. Roberts, Darrell Orydzuk, Jonathan Erich Drachenberg, Torben Hansen, Alison Elliott, Lauren Calvert","United States, Canada, United Kingdom","English, Danish",160,"Biography, Crime, Drama            ",30000000,15003764,2007,-14996236,-49.99
1822,The Omen,7.5,Richard Donner,"David Seltzer, Harvey Bernhard",62,"Gregory Peck, Lee Remick, Harvey Stephens, David Warner, Billie Whitelaw, Patrick Troughton, Martin Benson, Robert Rietty, Tommy Duggan, John Stride, Anthony Nicholls, Holly Palance, Roy Boyd, Freda Dowie, Sheila Raynor, Robert MacLeod, Bruce Boa, Don Fellows","United Kingdom, United States","English, Latin, Italian",111,"Horror, Mystery            ",2800000,60922980,1976,58122980,2075.82
1823,The Hate U Give,7.5,George Tillman Jr.,"Audrey Wells, Angie Thomas",81,"Amandla Stenberg, Regina Hall, Russell Hornsby, Anthony Mackie, Issa Rae, Common, Algee Smith, Sabrina Carpenter, KJ Apa, Dominique Fishback, Lamar Johnson, TJ Wright, Megan Lawless, Rhonda Johnson Dents, Tony Vaughn, Marcia Wright, Al Mitchell, Karan Kendrick",United States,English,133,"Crime, Drama            ",23000000,34934009,2019,11934009,51.89
1824,The Mauritanian,7.5,Kevin Macdonald,"Michael Bronner, Rory Haines, Sohrab Noshirvani",53,"Tahar Rahim, Nouhe Hamady Bari, Saadna Hamoud, Mohamed Yeslem Mousse, Mohamed Abderrahmane Arava, Aly Deyde, El Hocine Aba, Baya Belal, Baba Mine, Lemrabott Zeine Sidamar, Yenje Abdellahi, Jodie Foster, Shailene Woodley, Clayton Boyd, Denis Ménochet, Pope Jerrod, Daniel Janks, Ralph Lawson","United Kingdom, United States","English, French, Arabic, German, Latin",129,"Biography, Crime, Drama            ",14000000,7527030,2021,-6472970,-46.24
1826,The Hours,7.5,Stephen Daldry,"Michael Cunningham, David Hare",80,"Meryl Streep, Nicole Kidman, Julianne Moore, Stephen Dillane, Miranda Richardson, George Loftus, Charley Ramm, Sophie Wyburd, Lyndsey Marshal, Linda Bassett, Christian Coulson, Michael Culkin, John C. Reilly, Jack Rovello, Toni Collette, Margo Martindale, Colin Stinton, Ed Harris",United States,English,110,"Drama, Romance            ",25000000,108846217,2003,83846217,335.38
1828,Braindead,7.5,Peter Jackson,"Stephen Sinclair, Fran Walsh, Peter Jackson",54,"Timothy Balme, Diana Peñalver, Elizabeth Moody, Ian Watkin, Brenda Kendall, Stuart Devenie, Jed Brophy, Stephen Papps, Murray Keane, Glenis Levestam, Lewis Rowe, Elizabeth Mulfaxe, Harry Sinclair, Davina Whitehouse, Silvio Famularo, Brian Sergent, Peter Vere-Jones, Tina Regtien",New Zealand,"English, Spanish",104,"Comedy, Fantasy, Horror            ",3000000,242623,1995,-2757377,-91.91
1829,"Synecdoche, New York",7.5,Charlie Kaufman,Charlie Kaufman,67,"Philip Seymour Hoffman, Samantha Morton, Michelle Williams, Catherine Keener, Sadie Goldstein, Tom Noonan, Peter Friedman, Charles Techman, Josh Pais, Daniel London, Robert Seay, Stephen Adly Guirgis, Hope Davis, Frank Girardeau, Jennifer Jason Leigh, Amy Wright, Paul Sparks, Jerry Adler",United States,"English, German",124,Drama            ,20000000,4658401,2009,-15341599,-76.71
1830,Boys Don't Cry,7.5,Kimberly Peirce,"Kimberly Peirce, Andy Bienen",86,"Hilary Swank, Chloë Sevigny, Peter Sarsgaard, Brendan Sexton III, Alicia Goranson, Alison Folland, Jeannetta Arnette, Rob Campbell, Matt McGrath, Cheyenne Rushing, Robert Prentiss, Josh Ridgway, Craig Erickson, Stephanie Sechrist, Jerry Haynes, Lou Perryman, Lisa Renee Wilson, Jackson Kane",United States,English,118,"Biography, Crime, Drama            ",2000000,11540607,2000,9540607,477.03
1831,Field of Dreams,7.5,Phil Alden Robinson,"W.P. Kinsella, Phil Alden Robinson",57,"Kevin Costner, James Earl Jones, Ray Liotta, Amy Madigan, Gaby Hoffmann, Timothy Busfield, Burt Lancaster, Frank Whaley, Dwier Brown, James Andelin, Mary Anne Kean, Fern Persons, Kelly Coffield Park, Michael Milhoan, Steve Eastin, Charles Hoyes, Art LaFleur, Lee Garlington",United States,English,107,"Drama, Family, Fantasy            ",15000000,84431625,1989,69431625,462.88
1832,It's a Mad Mad Mad Mad World,7.5,Stanley Kramer,"William Rose, Tania Rose",59,"Spencer Tracy, Milton Berle, Ethel Merman, Mickey Rooney, Sid Caesar, Buddy Hackett, Dick Shawn, Phil Silvers, Terry-Thomas, Jonathan Winters, Edie Adams, Dorothy Provine, Eddie 'Rochester' Anderson, Jim Backus, Ben Blue, Joe E. Brown, Alan Carney, Chick Chandler",United States,"English, Chinese",210,"Action, Adventure, Comedy            ",9400000,46333064,1965,36933064,392.9
